{
  "schema_version": "riose.beta.scenario-contract/v1",
  "scenario_id": "brazil-rural-collision-stress",
  "description": "Two simulated tags use seeded 10 ms traffic phase with the pinned ns-3 adapter.",
  "seed": 11,
  "identities": [{"animal_id": "riose-animal-001", "tag_id": "riose-tag-001", "device_id": "riose-device-001"}, {"animal_id": "riose-animal-002", "tag_id": "riose-tag-002", "device_id": "riose-device-002"}],
  "environment": {"farm_id": "synthetic-farm-reference", "coordinate_frame": "ENU_LOCAL", "bounds_m": {"east_min_m": 0, "east_max_m": 1000, "north_min_m": 0, "north_max_m": 1000}, "classification": "SIMULATED"},
  "rf": {"mode": "sionna-rt", "classification": "SIMULATED", "parameters": {"frequency_hz": 915000000, "bandwidth_hz": 125000}},
  "network": {"mode": "ns-3-lorawan", "classification": "SIMULATED", "parameters": {"spreading_factor": 7, "payload_bytes": 12, "traffic_interval_s": 0.01}},
  "trajectory": {"source": "inline synthetic request trajectory; ground truth is score-only input", "classification": "SIMULATED", "samples": [{"animal_id": "riose-animal-001", "tag_id": "riose-tag-001", "timestamp_s": 0, "position_m": [120, 200, 10.780054003131093]}, {"animal_id": "riose-animal-002", "tag_id": "riose-tag-002", "timestamp_s": 0, "position_m": [130, 205, 10.780054003131093]}]},
  "movement": {"mode": "not-connected-to-RF-run", "classification": "NOT_EVALUATED"},
  "faults": ["PACKET_LOSS"],
  "localization": {"mode": "tdoa", "classification": "SIMULATED", "parameters": {"quality_bounds_required": true}},
  "blockchain": {"mode": "offline-fake-not-in-RF-run", "classification": "NOT_EVALUATED"},
  "expected_evidence": {"scenario": "SIMULATED", "rf": "SIMULATED", "network": "SIMULATED", "localization": "SIMULATED", "movement": "NOT_EVALUATED", "blockchain": "NOT_EVALUATED"}
}
